{
  "schemaVersion": "1.0.0",
  "bundleId": "evidence.execution.orders.offline",
  "bindings": {
    "sourceAssessmentDigest": "sha256:0000000000000000000000000000000000000000000000000000000000000000",
    "migrationPlanDigest": "sha256:0000000000000000000000000000000000000000000000000000000000000000",
    "rehearsalPlanDigest": "sha256:0000000000000000000000000000000000000000000000000000000000000000",
    "currentLineageDigest": "sha256:0000000000000000000000000000000000000000000000000000000000000000",
    "environmentReference": "environment.production.orders",
    "sourceReference": "source.postgresql.orders.primary",
    "targetReference": "target.postgresql.orders.flexible",
    "targetRegion": "centralus",
    "targetEngine": {
      "family": "postgresql",
      "major": 16,
      "minor": 4
    }
  },
  "attestations": [
    {
      "evidenceId": "evidence.live.source-catalog.1",
      "kind": "source-catalog",
      "observedAt": "2026-08-12T12:32:00Z",
      "expiresAt": "2026-08-13T12:32:00Z",
      "nonce": "nonce.evidence.source-catalog.1",
      "authorityReference": "authority.evidence.source-catalog",
      "signerKeyId": "key.evidence.source-catalog",
      "status": "confirmed",
      "capabilities": ["source-assessment-current", "source-authority-confirmed"],
      "evidenceReference": "record.evidence.source-catalog.1",
      "bindingDigest": "sha256:0000000000000000000000000000000000000000000000000000000000000000",
      "claimsDigest": "sha256:0000000000000000000000000000000000000000000000000000000000000000",
      "signature": "AA=="
    },
    {
      "evidenceId": "evidence.live.target-region-capacity.1",
      "kind": "target-region-capacity",
      "observedAt": "2026-08-12T12:33:00Z",
      "expiresAt": "2026-08-13T12:33:00Z",
      "nonce": "nonce.evidence.target-region-capacity.1",
      "authorityReference": "authority.evidence.target-region-capacity",
      "signerKeyId": "key.evidence.target-region-capacity",
      "status": "confirmed",
      "capabilities": ["target-capacity-confirmed", "target-region-confirmed"],
      "evidenceReference": "record.evidence.target-region-capacity.1",
      "bindingDigest": "sha256:0000000000000000000000000000000000000000000000000000000000000000",
      "claimsDigest": "sha256:0000000000000000000000000000000000000000000000000000000000000000",
      "signature": "AA=="
    },
    {
      "evidenceId": "evidence.live.secret-reference-metadata.1",
      "kind": "secret-reference-metadata",
      "observedAt": "2026-08-12T12:34:00Z",
      "expiresAt": "2026-08-13T12:34:00Z",
      "nonce": "nonce.evidence.secret-reference-metadata.1",
      "authorityReference": "authority.evidence.secret-reference-metadata",
      "signerKeyId": "key.evidence.secret-reference-metadata",
      "status": "confirmed",
      "capabilities": ["secret-references-versioned", "secret-values-excluded"],
      "evidenceReference": "record.evidence.secret-reference-metadata.1",
      "bindingDigest": "sha256:0000000000000000000000000000000000000000000000000000000000000000",
      "claimsDigest": "sha256:0000000000000000000000000000000000000000000000000000000000000000",
      "signature": "AA=="
    },
    {
      "evidenceId": "evidence.live.private-connectivity.1",
      "kind": "private-connectivity",
      "observedAt": "2026-08-12T12:35:00Z",
      "expiresAt": "2026-08-13T12:35:00Z",
      "nonce": "nonce.evidence.private-connectivity.1",
      "authorityReference": "authority.evidence.private-connectivity",
      "signerKeyId": "key.evidence.private-connectivity",
      "status": "confirmed",
      "capabilities": ["network-path-reviewed", "private-connectivity-confirmed"],
      "evidenceReference": "record.evidence.private-connectivity.1",
      "bindingDigest": "sha256:0000000000000000000000000000000000000000000000000000000000000000",
      "claimsDigest": "sha256:0000000000000000000000000000000000000000000000000000000000000000",
      "signature": "AA=="
    },
    {
      "evidenceId": "evidence.live.dns-application-readiness.1",
      "kind": "dns-application-readiness",
      "observedAt": "2026-08-12T12:36:00Z",
      "expiresAt": "2026-08-13T12:36:00Z",
      "nonce": "nonce.evidence.dns-application-readiness.1",
      "authorityReference": "authority.evidence.dns-application-readiness",
      "signerKeyId": "key.evidence.dns-application-readiness",
      "status": "confirmed",
      "capabilities": ["application-pool-drain-ready", "dns-change-ready"],
      "evidenceReference": "record.evidence.dns-application-readiness.1",
      "bindingDigest": "sha256:0000000000000000000000000000000000000000000000000000000000000000",
      "claimsDigest": "sha256:0000000000000000000000000000000000000000000000000000000000000000",
      "signature": "AA=="
    },
    {
      "evidenceId": "evidence.live.recovery-maintenance-owners.1",
      "kind": "recovery-maintenance-owners",
      "observedAt": "2026-08-12T12:37:00Z",
      "expiresAt": "2026-08-13T12:37:00Z",
      "nonce": "nonce.evidence.recovery-maintenance-owners.1",
      "authorityReference": "authority.evidence.recovery-maintenance-owners",
      "signerKeyId": "key.evidence.recovery-maintenance-owners",
      "status": "confirmed",
      "capabilities": ["maintenance-window-confirmed", "on-call-owner-confirmed", "rpo-rto-confirmed"],
      "evidenceReference": "record.evidence.recovery-maintenance-owners.1",
      "bindingDigest": "sha256:0000000000000000000000000000000000000000000000000000000000000000",
      "claimsDigest": "sha256:0000000000000000000000000000000000000000000000000000000000000000",
      "signature": "AA=="
    },
    {
      "evidenceId": "evidence.live.provider-iac-readiness.1",
      "kind": "provider-iac-readiness",
      "observedAt": "2026-08-12T12:38:00Z",
      "expiresAt": "2026-08-13T12:38:00Z",
      "nonce": "nonce.evidence.provider-iac-readiness.1",
      "authorityReference": "authority.evidence.provider-iac-readiness",
      "signerKeyId": "key.evidence.provider-iac-readiness",
      "status": "confirmed",
      "capabilities": ["iac-artifacts-reviewed", "privilege-boundary-reviewed", "provider-readiness-confirmed"],
      "evidenceReference": "record.evidence.provider-iac-readiness.1",
      "bindingDigest": "sha256:0000000000000000000000000000000000000000000000000000000000000000",
      "claimsDigest": "sha256:0000000000000000000000000000000000000000000000000000000000000000",
      "signature": "AA=="
    }
  ]
}
